<?xml version="1.0" encoding="UTF-8"?>
<!-- 被2013 sp1 () 使用XMLSpy v编辑的 (http://www.altova.com) by -->
<SpyBase xmlns="http://www.xml.org.cn/namespaces/SpyBase" xmlns:xsi="http://www.w3.org/2001/XMLSchema-instance" xsi:schemaLocation="http://www.xml.org.cn/namespaces/SpyBase SpyBase1_2.xsd">
	<aliasTable>
		<row aID="1">
			<spyREF>A001</spyREF>
			<alias>Spy Grrrl</alias>
		</row>
		<row aID="2">
			<spyREF>A001</spyREF>
			<alias>La Femme Nikki</alias>
		</row>
		<row aID="3">
			<spyREF>A006</spyREF>
			<alias>LL</alias>
		</row>
		<row aID="4">
			<spyREF>A006</spyREF>
			<alias>Fred</alias>
		</row>
		<row aID="5">
			<spyREF>A003</spyREF>
			<alias>Big Ears</alias>
		</row>
		<row aID="6">
			<spyREF>A004</spyREF>
			<alias>Inspector Gadget</alias>
		</row>
		<row aID="7">
			<spyREF>A004</spyREF>
			<alias>Don Adams</alias>
		</row>
	</aliasTable>
	<missionTable>
		<row mID="M101">
			<spyREF>A001</spyREF>
			<date>2005-4-15</date>
			<description>Crack the code</description>
			<status>Mission Accomplished</status>
		</row>
		<row mID="M102">
			<spyREF>A001</spyREF>
			<date>2006-2-15</date>
			<description>Get the source</description>
			<status>Mission Accomplished</status>
		</row>
		<row mID="M103">
			<spyREF>A001</spyREF>
			<date>2006-5-4</date>
			<description>Hit the target</description>
			<status>In progress</status>
		</row>
		<row mID="M104">
			<spyREF>A006</spyREF>
			<date>2006-6-15</date>
			<description>Shoot the rapid</description>
			<status>In progress</status>
		</row>
		<row mID="M105">
			<spyREF>A003</spyREF>
			<date>2005-11-4</date>
			<description>Get the big cheese</description>
			<status>In progress</status>
		</row>
		<row mID="M106">
			<spyREF>A003</spyREF>
			<date>2006-4-4</date>
			<description>Map the area</description>
			<status>In progress</status>
		</row>
		<row mID="M107">
			<spyREF>A099</spyREF>
			<date>2006-5-2</date>
			<description>Get smart</description>
			<status>In progress</status>
		</row>
		<row mID="M108">
			<spyREF>A004</spyREF>
			<date>1967-2-15</date>
			<description>Protect Chief</description>
			<status>In progress</status>
		</row>
		<row mID="M109">
			<spyREF>A004</spyREF>
			<date>2006-6-15</date>
			<description>Get some style</description>
			<status>Mission Accomplished</status>
		</row>
	</missionTable>
	<spyTable>
		<row spyID="A001">
			<firstName>Nikki</firstName>
			<lastName>Devgood</lastName>
		</row>
		<row spyID="A006">
			<firstName>Link</firstName>
			<lastName>Lister</lastName>
		</row>
		<row spyID="A003">
			<firstName>Danger</firstName>
			<lastName>Mause</lastName>
		</row>
		<row spyID="A099">
			<firstName>Barbara</firstName>
			<lastName>Feldon</lastName>
		</row>
		<row spyID="A004">
			<firstName>Maxwell</firstName>
			<lastName>Smart</lastName>
		</row>
	</spyTable>
</SpyBase>
